,Message
18532,"Hi Stewart, can you help make arrangements for us to see the other VVunit down the street? We might be able to make it on Wednesday. Howabout the Warren penthouse?"
18533,"Hi. I'm interested in your Villa Verde unit. Can you tell me thehouse number and street and approx built in GSF area? Thanks, Min"
18534,"Hi, I'm interested in your Villa Verde unit. Can you tell me thehouse number and street, and the approx built in GSF area? Thanks,Min"
18535,"Thanks! BTW, I also contacted Kesmond Yow on some other Villa Verdeunits. It seems that he may have other units you might not haveaccess to? We just want to have a more complete picture before makingan offer."
18536,"Hi Stewart, please Ler me know what the arrangements are withKesmond. I need to call him back later. Thanks"
18537,"Hi Stewart, can you help arrange the other two on next Wed lateafternoon eg ~5pm? Also, can you get any photographs of today's unit<#> avenue to us? Thank you for your help."
18538,Still going to be a while. Hope all is ok at home.
18539,Will be you when done.
18725,R u coming over tonight
18726,What time do u get off work
18727,Do u have to work tomorrow
18728,R we playing hoops saturday
18729,did u get my message last night
18735,Got prescription. Will be off for a couple of days while prescription works. Love Gin x
18736,Are you ok? Lobe Gin x
18737,What time are you back. Thomas and Lynne are here.Mum X
18738,Are you back for tea? Love Mum x
18739,What lunch are you on? Gin X
18740,see u at 8 at the RU
18741,wanna play GoW ? i'm online.
18742,I'm fine thx. Good nite.
18743,"Hey, where are u ? i'm waiting"
18744,"Not yet ToT, but i'll receive it tomorow i think"
18753,yea we need to keep playing it was fun
18754,oh ok ill be there
18755,yea where is it at
18756,Love you too
18757,It was nice seeing you last night. You should come around more often
18758,Alright see you then
18759,To worried about school. I totally regret it now lol
18760,"Thats the sad part, ive lived here like all my life and havent done much in my adult years"
18761,Sounds like fun. I really havent seen what michigan has to offer
18762,top notch see you then x x x
18763,"yeah thats good, il come yours first if you want and drive? half 1 is good for me x"
18764,im well early to work you bum! im gonna stop home tonight so il see you when i see you. :) i love you x x x
18765,ok im just getting ready :)
18766,okie pokey x
18767,who knows. sometimes i study. im in the middle of planning retreat for the guys too. its friday. whatre you up to
18768,sorry for not answering your telemarketing calls earlier
18769,Ga! I want to soo bad!
18770,i want to see him! Is he gonna be here tomorrow? I just left to see rach and wont be back til <#>
18771,Na you seem busy. Its not a big deal
18787,Looks like you've got the wrong number. This is Brandon
18788,Alicia! This is Brandon. When's our rehearsal for the voice event with Tali?
18789,Who is this! What!
18790,Hooray! That's so awesome! I hope she's enjoying the long drive. Haha now I have your number again!
18791,Awesome! What route are you guys taking?
18792,Haha nice! The <#> rest stops are so nice. You guys are going to have so much fun!
18793,Seriously! No tengo dinero :'( haha aww I bet he's so excited!
18794,Yeah I really really hope so!!!!!!!!!!!!!
18795,Mr.darcy was here on January <#> th! It's too late now :'(
18796,I heard that! So awesome.
18797,Haha sounds good! It was nice talking to you!
18798,Okay cool! Haha sorry about the multiple messages; I wasn't sure if my new phone was going through. Thanks!!
18799,Hey Erin! Sorry for the delayed response. I can totally come over tonight! What's the address?
18800,Awesome thank you! I'll leave here in like ten minutes. Tell Shevawn I said hi!
18801,I shall! :)
18802,I'm here!
18803,"Hey mom! Sorry for the delayed response. Thank you so much! I just played one of my original songs in the Wild Beast. This pop song writer gave us all kinds of information on the industry, and advice on pop song structure. Super cool! It looks like the fafsa's all filled out, so I'm gonna talk to financial aid tomorrow. Thanks again!"
18804,Philly Billy. We're hanging out tonight. Just a heads up
18805,Hell to the yeeuh!
18806,I'll be there in 5!
18807,Yo g-reg! What are you up to?
18808,Yo dude man. What are you doing tonight?
18809,Hahaha yeah I'm coming home Friday night!
18810,Yeah she does!
18811,"Yeah that'd be so cool! I'd totally be down. Of course it'd have to be sat or sun, but yeah!"
18812,Oh wow thank you so much! I'll be there around midnight
18813,Hey! I'm at the soquel high pancake breakfast
18814,"She did a ride along with a cop last night until 2, so she's still asleep. Haha and I'm really tired too!"
18815,Yeah for sure! Thank you
18816,"Hey! I just got back. I picked up some class supplies at target (notebooks, paper, pens etc.) and ordered one of my books off Amazon. I still need to get a couple more books for class this week, so if you could transfer some moolah over ASAP that would be so great! I'm going to talk to financial aid tomorrow, and I'll be sure to let you know how things go. Thanks for everything and talk to you soon!"
18817,Thank you thank you thank you!
18818,You are suuuuuch a stud! Did you fix office?
18819,Hahaha wow nice! Way to keep ahead of the curve
18820,"Dude I know he probably thinks it's a excuse, but that actually is the weekend of my mom's birthday. I would be so down to perform at redcat otherwise"
18821,Alright good! He seems like a great dude to work with. Please please please let me know if there's another opportunity like that in the future!!! Thanks so much for considering me
18822,Heck to the yeah man! :)
18823,Sounds great man thanks!
18824,"Hey mom! I can totally help you with Microsoft when I come back on Friday. I've got $ <#> right now, (books were expensive), and I need to buy milk and put $5 on my laundry card. Do you think before I come up you can transfer me a little cash for gas? That'd be super helpful :)"
18825,KAAAAAAAATTIE!!!! what is our reading for French diction?
18826,Yeah f'sho it is! Well sheeit
18827,Yo dude I totally forgot my keys. Can you leave the room unlocked?
18828,Dude be outside in like <#> minutes!
18829,Who this be? What shoes?
18830,Haha I think you've got the wrong guy
18831,Brandon Becker
18832,For sure dude
18833,Chilling with some friends! Who is this?
18834,I got a new phone so I lost all my contacts!
18835,Haha cool! This is Brandon Becker
18836,I'm <#> . This number totally looks familiar
18837,I went to soquel high school in Santa Cruz
18838,Nice nice. Haha I don't know why your name and number sound so familiar
18839,"You're super attractive! I would totally send you a pic if a) I was single, and b) it wasn't totally illegal for me to do so."
18840,Don't be offended! It was nice uh... meeting you haha
18841,No I'm <#> . If you were <#> it would have been no bueno
18842,Haha I didn't know that! I thought you still went to harbor. Lol nervermind then
18843,Sadly not. :) I'm going to go on a run! It was nice talking to you
18844,Haha nice!
18845,It was sick! I just got out of the shower.
18846,Thanks a lot! :)
18847,Oh I got that all sorted out! Calarts has my transcripts. I'm coming home Friday night :)
18848,Aaaamber it's Brandon give me dad's phone number!
18849,Hi mommy:-) we are on our way back to the house now.
18850,Okay sounds good!!
18851,Love you
18852,Haha of course!
18853,Already done!
18854,Are you almost here?
18855,Hey mom! just letting you know that I got back to school safely
18856,Dude not yet man! I'm going in a couple minutes
18857,Yo dude can you leave the door unlocked when you leave? I forgot my keys again
18858,Sweet!
18859,I don't know who this is!
18860,Dude f'sho man! Let's hang tonight. I'll text you at like seven or so. 5 3 1
18861,Nah brah!
18862,Oh sheeit where is that?
18863,Shit Charles! Well if you don't go maybe we can hang like <TIME> ish
18864,F'shoman! I'll be at the thang anyway
18865,The dance thang mayne! When does it start?
18866,Haha u guess I'm not going today!
18867,*i
18868,S'what I'm talking about! You wanna hang soon?
18869,Haha whatever's good man! I don't really care
18870,I'll come at nine yo!
18871,Dude nooooooo! Like <#> mins?
18872,Sheeit Charles!
18873,Do0d I'm gonna come over!
18874,Get in your room dood!
18875,Dood can I come over?
18876,Okay five minutes yo!
18877,Haha pretty good! You?
18878,Sweet! At least you have most of the day to yourself now :)
18879,Shweet! I'm going to the gym :)
18880,Sounds goot my loff!
18881,"Hello hello! Rehearsal's just about to start, and I get out at <TIME> :)"
18882,I love you so much. I just got out
18883,Nice! For mairin's play?
18884,Sweetness. Yeah I'm just doing some homework
18885,Yes we should! When can you?
18886,Okay cool. That'll give me plenty of time to finish
18887,Sure! You can just text me when you get back to your house or something :)
18888,I love you so much too! :*
18889,Haha woooooah. I have no idea
18890,Hello! What are you up to?
18891,Haha oh no! Well that works because I'm still doing homework! But I can talk :)
18892,I love you too! My voice is feeling % <#> recovered :)
18893,It was all the airborne! Like I would start feeling feverish and I would take airborne and it would go away :)
18894,Haha aww! I would if I could :)
18895,Woo hoo! I'm SHTILL translating this French poem :O
18896,You've been really good with exercising!
18897,Oh no. Oh my baby :*
18898,Aww babe :( eet weel be better soon!
18899,Shweet! Yeah I can totally Skype
18900,"Hello dahling! I'm dine with classes for the day, and just have rehearsal <TIME> to 3. Love you! :*"
18901,*done
18902,Hello b-b-baby!
18903,I'm good! Just walking back to the dorms :)
18904,Hooray! Do you have rehearsal today?
18905,Woah that's so awesome! I forgot :) tell Ruby I say hi!
18906,Haha sweet! In going on a run today :)
18907,It feels fantastic! And it's so nice out
18908,Sweet. Do you have any plans for the rest of the day?
18909,Nice! Wanna text me when you're done?
18910,Sounds goot! :) talk to you later
18911,Hello hello! I just finished a run and am going to take a quick shower!
18912,Hullo Hullo! How art thou?
18913,Whaaaaaaaat the heck!!!! My phone didn't notify me again!!!! I'm sorry babe. I was all wondering where you went! But alas it was my stupid phone... I just got out of the cafeteria :)
18914,It was good! I'm just going to the practice rooms now to prepare for voice lessons
18915,Tomorrow at 3 :) just need to make sure my Russian's in good shape. Haha I don't know if that'll happen
18916,Oh I feel you. So many silly technical difficulties just to answer their pointless and banal questions. My. Word.
18917,Yew shall persevere :*
18918,Noice! I'm just leaving the practice room :)
18919,It's super unique! Haha I'm just IPA-ing the whole song
18920,I'm writing my chord progressions for the keyboard test :'(
18921,I was horribly mistaken! I may just not do it.... I never got the keyboard paper :(
18922,"Seriously! But it'll be the first assignment I haven't completed, so not too bad."
18923,Dad ist goot! I just want to shleep
18924,Nooooo I'm still doing homework. I'm just saying I'm tired
18925,Yesh I do indeed
18926,I know! That would be sooo nice right now
18927,"Okay! I love you so much. Sorry I was kind of low energy tonight, it's just school. I really love and miss you :* sweet dreams and goodnight!"
18928,Oh no! Did you lose it?
18929,Oh. I'm sorry :( I'm in the practice room
18930,All right cool sounds good! I love you
18931,Hey mom! Wow I can't believe I didn't see this.... thank you!!
18932,Woohoo! I just got done shaving :)
18933,So clean! I musht trim my sideburns
18934,Haha muah! How was your day?
18935,Dad ist goot! I just got to shtarbucks before my rehearsal at 8 :)
18936,You're such a stud!!!! :) goot job!
18937,It really is! I'll text you after rehearsal to see if you're still awake. Love you! :*
18938,I'm dooooooone!
18939,And I don't have too much homework tonight! I just got a slight fever :(
18940,Sure! When can you?
18941,Cool! Just tell me when
18942,Yes! :)
18943,Hhhutddfjiuytedvhjigxbbjihdssweyugggyuhfft <#> *'&$----ghbhdxshjbbhfssrgcchi
18944,"Hello! I'm going to bed, and just wanted to say I'm really glad you're so patient, and I love you so much. Goodnight my loff"
18945,Haha oh no! Well just let me know when you find it
18946,Hello hello. I have class in like four minutes
18947,Love you too! :)
18948,Done! I'm gonna take a shower
18949,Yeah I'm done! I texted you
18950,What the heck! That's strange. I'm headed to the practice rooms
18951,? Nothing's wrong :) do I seem different?
18952,I feel normal :) I love you.
18953,After tomorrow morning the rest of this week will be unbelievably relaxing!
18954,Aww lame! We'll persevere. I'm still looking at the same French song
18955,Your room must be redikulusly clean! That's fantastic. This weekend I will clean... everything
18956,I have lots of dishes to do to! I'm so excited. This will be a weekend of productivity.
18957,I got a good grade on my television paper!
18958,I know! What a relief. How was your day?
18959,Oh yeaaahhh!!!!! Wow... was it pretty strange?
18960,Most definitely. You mean my messages?
18961,For sure! No I just didn't know what you meant. Gettin down to beeisness time. It's.. business time
18962,Cause business something something theez are my beeisness socks!
18963,They rock so hard! I'm doing some skeelz practice
18964,Indeed! What are you up to?
18965,Yeah for sure!
18966,Yo yo yo yo chicky! I'm on break :D
18967,Just going to the practice room to prepare for skills :) you?
18968,At one :)
18969,I miss you too! I really need to go on a run D:
18970,I definitely know what you mean. Oh my bookey bear!
18971,Dawson thank you! You're a crazy sprinter :O
18972,"Probably not :( today's I have a lot classes, but not busy ones. You know?"
18973,"I just have rehearsal tonight that'll be a little intense, but the last few have been fine so I'm sure I'll be okay :)"
18974,Totally! They just want as much memorized as possible tonight because we're staging. I gots it :)
18975,Oh I for sure know what you mean. I bet you've got it but your brain's playing games with you. I'm leaving ze practice room!
18976,Very goot! I love you and I'll talk to you later!
18977,Just got out of keyboard and I'm getting ready for rehearsal at seven :)
18978,I miss you too. When does your rehearsal start?
18979,Haha oh marnae.... you're so patient for putting up with her
18980,I just went to the cafeteria!
18981,I know! So stoked! I'm going to get my stuff ready for rehearsal and text you after :)
18982,I'm out of rehearsal!
18983,Hooray! I am in le practice room
18984,Just playing some peeyano
18985,Oh yeah. What's the card number again?
18986,:/
18987,Eek
18988,Can't wait til u get paid
18989,Partayyyy
18990,Go to Angelas house after work to pick up the tv.
18991,I finally did it! I finally figured out how to download mode for the sims. I got new hair for star!
18992,Lol yes all the time! What happened? Bad night?
18993,I know. I'm so sleepy. I think I have rls or something.
18994,Put gas after work
18995,$ <#>
18996,Restless leg syndrome. I couldn't sleep til I got up and walked around. Then I woke up all over again.
18997,I guess its better than those cramps I get that wake me up. Last time I got the worst one of my life. It hurt to walk for 2 days :/
18998,I do get a kick out of Mark freaking out cause he's trying to figure out why I'm yelling.
18999,Yes! I'm already losing my hair :(
19000,Oy. I just got an automated call from Sprint that if I don't pay my bill today they're turning off my phone. FML
19001,I've never had my phone turned off before. I feel so poor :'(
19002,U know that's your cue to cheer me up... sheesh
19003,Lol I forgot about that. But then no more texting u either :(
19004,Lol there's really a gay.com?
19005,So that's where u been hiding!
19006,Lol your crazy
19007,Lmao u just made me choke on my bagel
19008,They can't all be that bad.
19009,Lol then yeah u need to go somewhere else
19010,Apparently me over eating this past weekend wasn't as bad as I thought. Taking walks afterward must be helping because I lost another 5 pounds. Woohoo!
19011,Call me when u can
19012,So where r u takin me for dinner tonite?
19013,What r we doin for dads bday?
19014,Just have a party for her at peter piper
19015,What r we doing for your birthday?
19016,Oh. I can buy her cake =D
19017,Do u want to go eat somewhere?
19018,What does she like right now?
19019,Well pick a place
19020,What size does she wear?
19021,Ok. Mom said she wants to go to cheddars.
19022,Lol I like the Paris coin house but I'm too lazy to ask for cosigners. Plus my Italian house is still empty :/
19023,I donno. Maybe when they add yo babies.
19024,I haven't bought yo in so long they keep offering me a <#> % discount every time I log on.
19025,Long enough for us to make one ;) They will never let us earn cash. Peeps already have multis for coins. They'd go out of business.
19026,Eww licking our feet?
19027,Lol my cat has a foot fetish. He's always playing with my feet when I try to walk.
19028,Lol yeah she posted a sticky about it on the forums. And peep were saying they should remove it and ban her cause quit threads aren't allowed lol
19029,So how was work?
19030,"Here's the plan... we both pool together a bunch of money and buy lotto tickets. When we win, we won't tell nobody and go hideout in sunny Mexico."
19031,What would be the first thing you'd buy?
19032,Lol. I donno... u like blondes :/
19033,Lol deal
19034,Everyonev is CRAZZEY excempt me!!!
19035,Lol I don't remember sending that.
19036,Lol that's nothing. Yesterday mark was talking bout someone running 5k. And I was like oh that's not a lot of coins :/
19037,They turned off my phone this morning but its ok. Got my check today and paid my bill =D
19038,When is your last break?
19039,I know! Last time they cut off the internet the day I got paid. I really need to start playing the lotto.
19040,Lol..so how's your day going?
19041,Just starting? What time did u wake up?
19042,Ooh u slept in huh. Make those tips! We got lotto tickets to buy!
19043,No that wouldn't work. Id just lose all my money
19044,Yeah but I'd just ask for it again and again
19045,Deal!
19046,I thought u liked freaks. I like freaks.
19047,What did they do?
19048,Lmao omg
19049,Did u get a good tip?
19050,Lol at least u got a laugh
19051,Come over here. I'll tip u REAL good
19052,Whenever. Pick a day.
19053,Lol me too
19054,He's your date. They really want u to start playing again
19055,Lol hey don't forget u still owe me a date first.
19056,"McBride fell <#> stories, hitting the pavement like a Hefty Bag filled with vegetable soup."
19057,So what u doin today?
19058,LOL please tell
19059,Aw its ok. Just ask for help. Your a guy so nobody expects u to know anything.
19060,It's like when I go to autozone. They expect me to be dumb.
19061,Lmao yeah they're gonna think your a freak.
19062,Meanwhile I'm so happy cause mark is willingly getting his hair cut right now =D
19063,Oooh and guns n roses song just came on. Yay today is gonna be a good day!
19064,I know I get excited for the dumbest things but yesterday was a bad day. This is a good sign. Live and let die dum dum dum do do do
19065,Lol I know. Yesterday was so bad. Everything I did was wrong. I felt like Charlie Brown
19066,Hurry
19067,I'm such a sucker. My main diamond was loose on my wedding ring so I went to get it tightened. But they talked me into replacing it cause it was a lil chipped get the ring engraved and put the old diamond on a pendant.
19068,It's ok tho I got $ <#> credit at Kay jeweler
19069,Do u like red heads?
19070,Just a random curious question =D do u?
19071,On what? If he's muscular and rich? Lol jk
19072,Ok but he picks his nose a lot
19073,How's your day going so far?
19074,Sounds fun. Meanwhile I feel bad cause I missed a bridal shower. I just completely forgot but oh well I heard it was extremely boring.
19075,Lol mmmm chocolate pens...::drools::
19076,Lol yeah. But this was a boring one remember
19077,Lol leave me alone!
19078,Your terrible!
19079,Were u still going to move moms furniture today?
19080,U exaggerate about the blue light
19081,Doc convinced me to get my pupils dilated tho
19082,He said its covered.
19083,How much is the copy?
19084,Copay*
19085,Why? I thought it was <#>
19086,Did u already pay?
19087,Ok well see. Ask how come the Copay is high.
19088,I mean it. Go ask
19089,After years of nagging I finally got mark to get contacts Woohoo!
19090,Lol I know. And he suggested the contacts. So I asked him are u cheating on me?
19091,Lol I did. No evidence
19092,I checked online. In case he deleted anything off his phone. I know I'm terrible. But I had to check.
19093,We went to the eye doc today. I was gonna txt u earlier but they dilated my eyes and small words were blurry.
19094,Lol I know. At least they got rid of the puff of air in your eye. I really hated that. Docs suck. I donno y women r so determined to marry them.
19095,Lol oh yeah. Screw men Ill make my own money without poking ppl in the eye
19096,So how's work?
19097,Oooh buy me a drink
19098,Send it on over!
19099,Really? Cause I want the moon...
19100,It's cheaper to do a plan with me. Unlimited everything is required if u want a good phone. By yourself on Verizon with your discount is $ <#> /month. Adding to mine would be an extra $ <#> . That is for the plan. Phones are cheaper at best buy. HTC evo shift is $ <#> there. At sprint.com its $ <#> . It's a good deal.
19101,When is your next break?
19102,The weekend is almost here tho =D
19103,Eek. It's been warm here for weeks now. I don't think its gonna get cold here again.
19104,My moms bday on Sat. I got her a book with a pic of an old lady on it saying where did I leave my glasses...lol then I'll give her the real gift.
19105,I know. Like when she was taking FOREVER to bring my pain meds. I found out why too. She thought I legally changed my name to Cortez. So they couldn't find it.
19106,No! I never wanted to. But everyone kept hounding me about it. Even my dad asked Mark if he was really gonna 'let' me keep my last name. So I just changed it on FB to shut everyone up :/
19107,Lol well they left me alone after that
19108,nobody I know uses a house phone. It's all cell phones.
19109,Cause I keep forgetting to buy lotto tickets
19110,Joanna got scammed. I warned her about it a week ago but she blew me off. Tsk tsk tsk
19111,They found a way to change the item they put in trade to look like an <#> costume. Your really getting a bikini bottom or something cheap. But on your end it will show up as the right costume. Ppl have been making threads about it on the forums for weeks now. Ninjas just close them and say they are false rumors.
19112,But it happened to Joanna today. She traded <#> k for pb bunny that ended up being pants. I warned her tho. She said she was gonna buy an <#> to resell later for profit. I told her all about it and to not to buy anything big for a while. She just said nah they will fix it by the time she saves up.
19113,Lol but I miss u :(
19114,Yes but u need to marry me first. I'm not quitting til I get married!
19115,Yes. You're taking to long
19116,That's your fault!
19117,We were supposed to have one together but your never on :(
19118,Fish!
19119,Remember we were supposed to have a bunch of male strippers?
19120,Ugh MEN!
19121,Ooh I like the winning outfit from the design contest.
19122,U need the handheld beer
19123,No its a regular beer bottle
19124,No u just have bad eyes.
19125,The rings are the ones u can't see
19126,Cause you're a jerk too!
19127,I used to be but I got fired. I wonder why :(
19128,It's a man's world...even I hate women lol
19129,When are u gonna get on fb?
19130,Can u use any sick time?
19131,It's Friday woot woot!
19132,Let's go party!
19133,Pfft I been drinking since this morning!
19134,You'll never know
19135,Ugh fine...u caught me :/
19136,Lol good luck
19137,Anytime!
19138,Ringer was off
19139,<#> <#>
19140,What happened to calling me back?
19141,Don't forget to take your first break late to call acs about getting the cats fixed. They take calls from 9 to <#> . Try to schedule all the girls. Tell them you live at your moms address. When I take the boys later I will use our address. The # is <#> <#> .
19142,Don't forget to use your moms address. It's important!
19143,Maintenance was fixing the ac. Didn't hear my phone. Anything happen?
19144,Long time no text :( miss u
19145,Where u been hiding?
19146,Lol can I join?
19147,Ok your scaring me. U usually kick me outta bed. What's the deal?
19148,Boo but it be so fun!
19149,I miss working at the movies :(
19150,So what r we doing for dads bday? Should we just take food to his house?
19151,Yes! I worked at the Alamo Drafthouse. it was the best job I ever had. Free tix free drinks and food. And the guys were sooo cute! I shouldn't have quit!
19152,Lol I completely forgot about it til yesterday when we went. It was my first job. I should have kept it til I was old enough to drink :/
19153,Whenever u decide to visit me I'll take u =D
19154,How's your week been?
19155,Mmm lobster ::drools::
19156,You've got to take pics!
19157,Oooh la la can't wait to see it!
19158,Have u been to hershey?
19159,:( I wanna go. Take me
19160,Mmhhmm just like weregetting yomarried 'one day'
19161,Call me when u get a chance
19162,Were going to dads this Saturday at 5 for his bday. I'm either taking him chicken or pizza
