,Message
45048,Ok. I need the answer early. Tomorrow is Friday already. Pleaseanswer so that I can tell them a correct answer. Thank you.
45049,"Hi Ricky, can I get the *confirmed* timing for the painter? Thank you."
45050,I don't know whether its convenient but ok. Can you contact my nextdoor neighbor mr wee directly? Will you be going down with themtoday?
45051,"I don't have their number. If they can go down today, can you callAlicia to ask the neighbors to prepare for the specific time that theycan go down? Please call her. Thanks."
45052,"Hi Ricky, I need to check with you about the outstanding issues. 1)soil for the backyard, 2) mirror installation, 3) paint touch up and4) plastic edge for the sliding glass door, 5) bathtub sanding, 6)glass silicone sealup of bottom edge of big window. Finally, can youtell me about my neighbor's paint progress? Thanks."
45053,"Oops, forgot two more. 7) house number gold sticker, 8) tiler'smaster bath access door coming apart. Thanks."
45054,"Thee bathtub guys can comes anytime this week, preferably onwednesday. As for the painter, just let me know. Also I still needthe color scheme for the house from you for my records. Finally, howabout the other items? Thanks"
45055,Please start without me. Only able to leave school now.
45056,"Hi Ricky, can I get a firm date and time for the bathtub polishing?We are still waiting for your people to fix this outstanding itemsince 3 weeks now. Also what about the other items that I mentionedearlier? Please reply. Thanks"
45057,Still don't know. Probably not. Will chase.
45058,"Hi Ricky, I cant seem to reach you. Can you call back before <#>or sms me about today's activities? Will the bathtub folks cometoday?"
45059,Bathtub probably Wednesday. Will confirm later.
45060,"Do you want me to try to arrange for bathtub on Thursday instead, sothat we can get other things done tomorrow?"
45061,Did you order the pizza already? Will be back around 8
45062,Ok. Wait for me then
45063,Ok. Sorry.
45064,"hi ricky, no one will be at home thursday afternoon, so if you andthe contractors are coming they must come and finish before <#> .Otherwise can you re arrange for another day? Thanks."
45065,Can you put another day? As said no one will be around on Thursdayand your guys cannot get in.
45066,"Msg 27: from <3752a4ca0fb31b06b860fa9bc47d8df487f52cf1f07d98dd> , to<a3c4a6b05b76282d87f52cf1f07d98dd> , ""2011.09.15 03:51:58"
45067,Should be ok
45068,"Art clementi running errands . Going to da bao crystal jade. :-) no pork, ok?"
45069,Or I can get Nasi for Wahni
45070,No... in the shoe cabinet or on the dining room table?
45071,Leaving Nus now. Please start if hungry. I cant find the bicycle keyin the car.
45072,Sitting near the dry provisions shop
45073,"Hi Ricky, I need to check with you about the outstanding issues. 1)soil for the backyard, 2) paint touch up and 3) plastic edge for thesliding glass door, 4) bathtub sanding, 5) gold color for house number(the glass people says the existing is sandblasted not a sticker), 6)tiler's access door to be reconstructed, 7) please send me the colorscheme for the house. Finally, can you tell me about my neighbor'spaint progress? Thanks."
45074,Any news?
45075,"Ok. We may not be home today at <#> , but our maid will let you andyour bathtub people in. Can you get back ro me about the other items?Thanks."
45076,"Msg 37: from <3752a4ca0fb31b06b860fa9bc47d8df487f52cf1f07d98dd> , to<cbe613097f93658987f52cf1f07d98dd> , ""2011.09.22 11:40:16"
45077,Ok. Will try to reach by 5pm. :-)
45078,In line <#>
45079,"Hi Ricky, I know you said to wait until tomorrow, but if you wantupdate me on the remaining items, i'd appreciate it. Especially thetradehub <#> curtain store name."
45080,"Hi Anindya , I think we have a cal in ten minutes. I will give you aring, since I'm not in the office. Are you overseas?"
45081,Ok. No prob :-)
45082,"Hi, can I get the promised update about when the contractors arecoming? Wednesday is ok this week."
45083,"Blanket is outside your door. Don't know whether you will get cold.Also your tea is in the dry kitchen refrigerator, wrapped withplastic."
45084,Coming back now.
45085,"Hi shir, I'm here."
45086,He's getting tired. Maybe another <#> mins
45087,"When you da Pao, tell them not to close the containers so you can putthe curry on top."
45088,please start. Leaving now. Need to get petrol.
45089,I'm at the food court.
45090,"leaving at 7+. Let me know whether to da bao, otherwise will justcome home to take you out for dinner."
45091,Back in three minutes.
45092,"<#> Boonlay Way # <#> Tradehub <#> S <#> .. Hi! Sir, just mentionmy name..and Company..Thank you.."
45093,"Msg 54: from <3752a4ca0fb31b06b860fa9bc47d8df487f52cf1f07d98dd> , to<8c0a99aa600c281987f52cf1f07d98dd> , ""2011.10.01 09:39:25"
45094,"Sorry missed your call. We figured it out, we had someone else's carkeys by accident. Thanks for calling back!"
45095,From Ricky. Hi sir! They can come today..after 4 pm..Thank you..
45096,Any or nee or other orders for da pao?
45097,"Msg 58: from <3752a4ca0fb31b06b860fa9bc47d8df487f52cf1f07d98dd> , to<acef5ca33641dcec87f52cf1f07d98dd> , ""2011.10.05 08:13:36"
45098,I you have an email address please let me know. Otherwise will sendto enquiries @ azora
45099,"Hi ing Cheong, thanks. Will you be at tradehub <#> tomorrow so thatwe can consult with you? Any particular timing?"
45100,"Perhaps after 3pm ? Tentatively, since our child 's schedule is notfixed yet. Thanks!"
45101,Ok. Thanks. I have sent the documents to your yahoo.com.sg account.Hope you can read it. :-)
45102,Please start first. Only leaving now and need to get petrol.
45103,Call me if you get this. I can da bao if you want.
45104,I'm in Harvey Norman
45105,All done. Waiting for you.
45106,"Hi Ing Cheong, do you have time Saturday or tomorrow evening after<TIME> to come up to our place at 4 verde crescent to help us selectcurtains? Thanks."
45107,"Good morning, how about Saturday at <#> am?"
45108,"Great, thanks!"
45109,"Hi, this is my mobile number and my email address is <EMAIL>"
45110,"Hi Ing Cheong, how about coming by again tomorrow morning at <#>noon? If you have a quotation you can email it to me when convenient. Thanks!"
45111,Ok. We met to discuss the visualization. Nothing in particular came up.
45112,I will try to come up with a better text for the paper.
45113,"Hi Ing Cheong, how about coming to our house after 7pm today? Wouldthat work for you?"
45114,"Yes, thanks! See you later!"
45115,"Yes, for the example. Can you send your up to date version via email?"
45116,Ing Cheong will come around 7pm tonight
45117,"Hi Ing Cheong, can you bring a sample of the sheer? Thanls"
45118,"Hi ricky, just sent you email. Any news about the painter?"
45119,Can you make sure Wahni doesn't bolt the main door? Thanks!
45120,Any news about the painter? I understand from Alicia that your roofguy will come tomorrow to check the polycarbonate roof.
45121,"Msg 82: from <3752a4ca0fb31b06b860fa9bc47d8df487f52cf1f07d98dd> , to<062fa69577a9d4dac1e59213faef1c4c> , ""2011.10.22 12:09:22"
45122,Still will be a while. Pork for porrodge not cooked yet.
45123,"Please ignore last sms, hit wrong button"
45124,Q <#>
45125,"Hi Alan, thanks to you and your family yesterday for the nice lunchat Prima and walk at Henderson Waves, we appreciated very much. Bestwishes to you and your family for your upcoming wedding!"
45126,"Couldn't get you on the phone. All done, coming home now."
45127,"Yes, you can my number now if you want. :-)"
45128,"Hi ricky, any update about either the gold paint for the house numberor the paint scheme? Don't want to have keep asking... thanks"
45129,"Hi Ing Cheong, any updates for our child's curtains? Thanks!"
45130,"Sure, np"
45131,Leaving now. Will be back by 8.
45132,"Hi Ing Cheong, any news?"
45133,"Hi Ricky, any update?"
45134,"Hi Ing Cheong, do you have the timing for tomorrow yet? Thanks!"
45135,Still stuck at the office. Will be leaving soon. Please.start first.
45136,"Time is ok, but hope you can come earlier in your slot e.g. <TIME> .Please call in advance."
45137,"Time is ok, but hope they can come earlier in your slot e.g. <TIME>. Have written to them as well."
45138,1? I just finished Varun's exam
45139,Leaving now. Please start first. :-)
45140,Will be about 5 mins late.
45141,"Hi Yeng Chin, sure I will try to do so. Also, can you sms your ICnumber to me? Just for record keeping. Will try to let you know bytwo weeks time."
45142,"Hi Yeng Chin, thanks. My IC is <#> g"
45143,"Hi Yeng Chin, ill get back to you on it. Need to check myavailability first. Thanks."
45144,Lta eday <#>
45145,Lta eday buy <#>
45146,"Hi Yeng Chin, I'm at the toyota dealership to do regular servicing ofmy car today. The bumper repair is <#> inclusive of gst. I can emailyou the invoice if you give me your email. Ok with you?"
45147,"Hi Yeng Chin, ok thanks for the go-ahead. I will send you thescanned estimate later and give you a scanned, paid tax invoice whenI've paid for the repairs."
45148,"Hi Yeng Chin, I believe so. Sorry for not returning your sms earlier."
45149,"Hi, thanks. Ill try to stop by b4 5pm"
45150,"Hi Yeng Chin, as per my email, the repair is finished already.Please Premier the <#> to my account today if possible. Thanks!"
45151,"Sorry I meant ""remit"".. thanks."
45152,"Hi Yeng Chin, I received it. Thanks for doing it. That resolves it."
45153,"If Sis wants to see him, I can bring him out. Otherwise, we'll juststay home."
45154,Mobilepay
45155,Ok. I will leave ard <TIME>
45156,Any da bao requests?
45157,Please start first if you're hungry.
45158,"I'm parked on the satay side. Just come oh, when you're done."
45159,Ok. He's fine :-)
45160,"Msg 140: from <3752a4ca0fb31b06b860fa9bc47d8df487f52cf1f07d98dd> , to<a6ae4681c787661d87f52cf1f07d98dd> , ""2011.11.29 01:09:36"
45161,Hope you are feeling better. Going to VivoCity later. Do you wantme to da bao fish soup for you from Bukit batok for later/tomorrow?
45162,"No worries, we're here. Should we wait for you to go in?"
45163,"Hi ricky, not sure what you mean. We are busy till around the weekof the <#> th. Can it wait till then? Thanks"
45164,"Hi Ricky, sorry was out of country. Can talk or meet with you at yourconvenience. Let me know. Sorry about the long silence."
45165,"Yes, can meet on Wednesday. Can you let me know what the problem is?Thanks! Happy holidays."
45166,"Sorry Ricky, I don't understand your message. By our accounts, westill had remaining credit from you which we used with azora. I don'tthink we own u home and money. But will be happy to discuss with you."
45167,MC <DECIMAL> <#> <#> S <#> C
45168,Love you bunches and bunches. Please take good care of yourself andbao bao. :-)
45169,"At the hotel, but no wireless. Borrowing wei tsang's wired connectionnow. Missing u all lots. All's ok here. Going dinner soon."
45170,"Feel free to sms, I can receive for free. Hope all is ok on this first day."
45171,"hi kissy, at bj airport now. Waiting for the gate to open at <#> .Missing you lots. Hope today went well. Will be back soon. Please restwell. Hugs, huggy :-)"
45172,Converted car but also must go to Shenton way to top up insurancebefore I can pay road tax. Going there now.
45173,Probably will make my way to av after that.
45174,"ok, that's fine. Maybe around <TIME> pm? Strange, I did't get yoursms till now. At Chartis at Shenton way now."
45175,"Hp running flat meet at Ikea restaurant. May be late, because oldinspection center closed down. Now at jurong."
45176,"Sure, ayam panggang three sets?"
45177,Pang gang is the black sauce type. Ok?
45178,"Ok, I will get three panggang now. Done at medical clinic, says noantibiotics will help. :-("
45179,"Hi Sis, we'll go to the airport on our own tomorrow so no need tocome with us."
45180,"Msg 172: from <3752a4ca0fb31b06b860fa9bc47d8df487f52cf1f07d98dd> , to<7c450fcffda82c8687f52cf1f07d98dd> , ""2012.01.28 11:03:54"
45181,"Msg 173: from <3752a4ca0fb31b06b860fa9bc47d8df487f52cf1f07d98dd> , to<7c450fcffda82c8687f52cf1f07d98dd> , ""2012.01.30 02:38:40"
45182,"Hi ricky, any progress?"
45183,"Hi ricky, I'm not asking for help from the plumber... please see myearlier message and read carefully. If you are not sure what I meancall me please."
45184,Did you take my chow mee fun? Couldnt find the packet in the car.
45185,"Ok, will check later thanks."
45186,Please start without me. Only leaving school now.
45187,Kiddie palace at # <#>
45188,was planning to leave now but traffic very bad. Will leave after 7 soplease start wihtout me.
45189,"Leaving now, roads still jammed. Don't wait for me. Sorry."
45190,"Msg 183: from <3752a4ca0fb31b06b860fa9bc47d8df487f52cf1f07d98dd> , to<3f20eaaf9243c8c2f86c5f0a74eb2cd6> , ""2012.02.07 01:10:59"
45191,"Hi Ricky, it's been two weeks since I started asking about the PUBproblem. Any progress?"
45192,"Hi Ricky, I didn't get the name. If you want me to do it, please askuhome to return me the money for your charge. You charged <#> fordoing it and I want you to complete the work and verification withoutneeding my help. <#> is reallly a lot of money for filling a fewforms. Please let me know the progress. Thanks."
45193,Please start if hungry. Only leaving school soon. Trying to finishediting one part.
45194,Leaving now.
45195,"Hi Ricky, it's been four weeks since I started asking about the PUBproblem. I got yet another bill stating I have 5 taps. When is thisgoing to be fixed? Any progress?"
45196,Thanks. Hope to hear from you soon.
45197,At level 3 kopitiam
45198,"Glad to hear it went ok. Yes, unfortunately that's exactly the day ofthe workshop, so guess that you'll have to handle it alone again.Sorry: ( :("
45199,Please start without me. Only leaving school now. Very late tryingto finish some reviewing first.
45200,How it is going? All ok with you and nate?
45201,Thanks for replying. Sorry everything is so tough. Then I willcontinue to work for a while. Love you lots. Give fussypot a big hugfrom me.
45202,At cafe w table and book :-)
45203,cross your fingers
45204,ya'll just having fun
45205,nice car
45206,meet you at the park
45207,getting the girls dressed
45208,she is dancing with the boys and girls
45209,accendent on the parkway
45210,she ate the peperonie now eating the pizza
45211,getting everyone tea unless you send what you want
45212,Both of them are snoozing
45399,are you woking
45400,i dont have a job
45401,we should go to cicis pizza
45402,call ernesto
45403,i think he is working today
45404,do you still have your ps3
45405,i sold mine yesterday
45406,my dog got his ears cropped
45407,see you later
45439,Hey Casey when r u bringing the babies over
45440,Ok c u then
45441,Sorry running behind be there shortly
45442,Can u pick up some milk and eggs from the grocery
45443,Have u talked to Shawn today
45444,When r u going to be over
45445,Your mom told me you were coming
45446,Sounds good.......
45447,Will it all fit in the back of the pickup
45448,Did you take the baby for his shots?
45663,I'll probably wait until dad comes tomorrow the box is really heavy and I don't think I can carry it by myself and I'd have to go to the ATM etc
45664,please dont make me do that
45665,"Oh okay, no worries it's no big deal."
45666,"Good luck, try scientology."
45667,"Okay, I'll have it out there in five minutes."
45668,"Moms not here and you can't come in, but I'll leave your stuff on the porch and you can get it in an hour."
45669,"No I think it was next door but I didn't know if you were trying to get in, dads having ""bowel"" trouble today he's not coming by"
45670,hey do you know where you put the charger for barak's computer i was going to fix it so it works better
45671,"I just want a plate of california roll sushi I'm craving, I'm working today and I can't leave this job today I need to take it while it's available"
45672,and if they don't have it out at the deli they will have it in the back frozen
46094,s aid sure
46095,Sorry I just got my contacts switched to my new phone xP
46096,"I've never seen bleach... but death note is awesomeeee... and mybreak is awesome, yours?=D"
46097,Daaaayum! I've been sleeping hahahah
46098,Chcolate chocolate chocolate! I'm gonna draw you a picture theinstant one comes out nicely!
46099,Happy new years!!
46100,Mission
46101,Are you meeting us at midsion or here?
46102,Ariund when are you coming ?
46103,Hoaky text meh
46104,We in da fiid court
46105,Food
46106,Heeey my phone died so I'm using my sister's phone
46107,Of course I do :) but I have to go soon anyway cause the movie'sgonna start soon :(
46108,"Okay I'll talk to you after, I promise c: ttyl"
46109,Chocolate!
46110,Dinner yo
46111,Check in with southwest in <#> min!!!
46112,What's youe confiemation number?
46113,Oh okay.. yay!
46114,What time will you get there?
46115,Where do yu live o.O
46116,"I,m leaving in <#>"
46117,Not to check in but security is growing. I'm not through security yet though
46118,"Meet me, I'm not through security"
46119,Ohhaha
46120,When are you free yo?
46121,"Oh crap! I think so one sec, have to check witu my roomies aboutgrocery shopping"
46122,Are we grocery shopping tomorrow? I nee to know when so I can knowif I can go with my friend
46123,You can do it! I believe in you!
46124,I hav to grocery shop at 6
46125,Eek sorry.. medium?
46126,Are we going to <#> tomorrow?
46127,Oh no you disappeared!
46128,Hey! Did you guys get home alright?
46129,Eee yes! It's super awesome! You're amazing Grace!
46130,Awesome! Listening to it now. Sounds great! Love ya!
46131,Uh sure.. he's in class so after ^^
46132,"Alright! Just listened to the others, they sound awesome!"
46133,Oh my that's awful! I take it people were pretty injured?
46134,driving is terrifying. Instant death in a fiery explosion isstill pretty bad to me
46135,Very true. A lot of fears are very healthy though
46136,"Hey dad, would you be able to read something for me?"
46137,"Alright, sent"
46138,KEEP QUIET NOTHING COMES AS EASY AS YOU
46139,You're stepping on my civil rights. AND IIIT'S AAAL MII-HI-HIIINE
46140,"My life has meaning again! But seriousky, wtf PEOPLE DON'T ACTUALLYGO ON HIATUS"
46141,Haha I appreciate that more than I can say xP
46142,This is why <#> didn't happen
46143,It's times like this when you have to accept being <#> forever
46144,Whhhhaat? Really?
46145,Oh man. Did she bring the law suit?
46146,"Hahaha that is pretty ew. Bee tee double u, have you seen FMA?"
46147,Chris is trying to make me watch it and I'm not sure that I want to. Hm
46148,But soul crushingly sad!
46149,"Very true. Which reminds me, have you read any John Green?"
46150,"Dude. Read The Fault in Our Stars. So amazing. I liked Looking forAlaska, even if Alaska was one crazy"
46151,Right? I was lik DA FUQ IS WRONG WITH THIS BITCH
46152,Mmhm
46153,Are you just writing native speaker for english proficiency? Orshould I put more?
46154,Sweet. Submittiiinnggg. Eeee.
46155,We need to remake jeopardy.. are you free in a few?
46156,Am I meeting you guys?
46157,We're gonna get dinner in like <#>
46158,Hahaha that's really silly
46159,Will one of you guys take out chickkkeeennnn?
46160,Oh snap! She's at Walgreens!
46161,I tried to make my red shirt obvious =(
46162,SHE'S GONNA SUE ME
46163,Raaaaaaaaaa
46164,AGONY...... far more painful than yours
46165,Chocolate
46166,"I didn't notice the date until I sent mom an into the woods referencetoo! Eek! I'm super sorry and I love you so much dad and hope you hada good birthday! Sorry, I'm terrible =( happy birthday dad, I loveyou.. give me a call next time you're free/it's not the middle of thenight ohio time.. sorry!!"
46167,ARE YOU STILL ALIVE????
46168,YES! We should all have dinner! I miss you despite the fact thatyou're crazy =P
46169,You got me!
46170,Rachaaaeeellll I love you!
46171,Dude your voice
46172,Hahah I didn't I just wanted you to know you're awesome!
46173,I miss it. And the rest of you
46174,Hopefully soon. I'm going crazy.they only know less mis because ofthe movie and like one other musical out here. And the anime peopleare... scarce haha
46175,Yaaaaaay!
46176,It's pretty bad. I just want to do two persob renditions of musicalsand maybe break a few toes to Boys Like Girls =P
46177,That was also the day you got me into motion city soundtrack and backinto FOB haha
46178,I know.. depressing
46179,End of march. Hopefully I won't be perpetually ill again
46180,Dinner?! =D
46181,Awesome! Got it!
46182,Were you in Doe when the power went out?
46183,Huh. I told my roommate she was very impressed =P
46184,"Ha, wrote that's all really interesting! Pretty funny, little old Akron"
46185,Maybe <TIME> ?
46186,Hahaha I see
46187,Happy Valentine's day!Really? Huh
46188,"It was so scary! Our doors slammed shut and stuff too.. btw, sorryI've been MIA, I didn't have a comp so all my free time was usingschool ones =("
46189,That... is a pretty glad good point
46190,It totally was! The lights flickered and a huge breeze went throughsomehow (seriously) and all the stuff on the wall rattled...
46191,You really would have. I miss you so much! =(=(
46192,Yes! I also plan to repent for being the worst friend ever to one ofthe awesomest people I've ever net =(
46193,A lot of people get CHOCOLATE on Valentine's day..... including you
46194,Are you living in an apt next year?
46195,Chocolate! Hey do you have any idea where my hard drive is? It has acopy of one of my plays and some pictures I need
46196,Sweet! I'll check it out!
46197,Dang it! I forgot!Is there any way I could get it from you by chance?
46198,<#> ish
46199,Padmapper
46200,Hey! You should join us for dinner later!
46201,Yo! Just wanted to remind you about the hard drive if you get achance anytime soon! Love ya!
46202,"Pretty much anytime after SLUgS. You have class, right?"
46203,"Okay, awesome!"
46204,"In class, I'll call you back soon"
46205,Eek sorry! I have excedrine if you need it.. not in campus but I canhead there (I have to eventually anyway)
46206,Well I have to come anyway so I could just come now
46207,"Haha, be there soon"
46208,I can come up
46209,I'm going crazy
46210,Iiii wanna learn farsi!
46211,It's a great language! But you're motivation too =P
46212,"You should! If I start learning, I'm coming to you"
46213,Luckily I don't wanna be a Farsi scholar =P
46214,I'm trans-communist.
46215,"Wow, that was really hard to type."
46216,"Yeah I saw.. Alright, but I won't be home til late and I still don't want to"
46217,David! You should come with us after SLUgS!
46218,Ling <#> OH
46219,Next to me there's some room =P
46220,No thanks lol.. just come in!
46221,Email alex
46222,They preferred Channing!
46223,I miss you so much too! When I'm home in 3 weeks we have to blastsome panic and fob <3
46224,Sure what's up? (Though I have to say <name> knows that one more thanme so sorry if I suck)
46225,"So basically you wanna break up C clusters by inserting schwa. Youshould look at the he direction and when stuff is inserted. So youshould have no more than cc clusters. It also doesn't like wordinitial cc, so break that up"
46226,The schwa will wanna quarantine the first c cluster it sees... so itbreaks thr first c off first going r-l
46227,It doesn't mind cc or c# or #c but doesn't want ccc. The direction isthe main point. It takes the right most cc or c# and schwas it off andthen from there keeps going in groups of two until there are no more
46228,I thiiink so but I'm not sure. Like ccc#>ccec# and then ccc>cecc...but maybe you can combine those rules
46229,"Hahah no problem, I'm really glad to help!"
46230,I hope I wasn't unclear when I was explaining everything!
46231,What's up? Class
46232,Thanks Grace! =D
46233,P 5 actionsartP4 person hierarchy
46234,P7 nv distinction
46235,Can you do the Channing?
46236,Yeah the <#>
46237,Probably peking express but I'm getting something else haha
46238,No answer =/
46239,I know... uuuggh
46240,"I will, don't worry"
46241,Ah sorry! I was in Berkeley bowl!
46242,Iiii think it's okay =o
46243,Okay! =)
46244,Are we going to the premium one at two?
46245,Sproul?
46246,I won't be done until <TIME> though =o
46247,"Okay, cool =)"
46248,"Hey, on my way.. are you still there?"
46249,Cancel experimentAstro lab
46250,"James, Chris, and Conor... do you remember any of their last names?"
46251,Damn xP
46252,Really? Weird haha
46253,I need a member for a band and thought James would make a gooscandidate because he already exists
46254,"No, go for it"
46255,"Yeah, I thought Ross works =P out might've even been James Rossknowing 8th grade us hahah"
46256,We cant spray on apr 1? Dude we have to be here and no one has timein the week
46257,That means this week we have to wash everything.. so you have time?
46258,I'm do the mattress as soon as I get back
46259,"I have coins, we'll figure out our"
46260,Happy birthday! I'm on your bus =P
46261,"James Ross born April <#> , <#> according to 'his' website. Also,he liked supernovas"
46262,Yup =P went to gaia and even other realm rp
46263,Hey can you find the mega bus email and send it to me?
46264,Can you guys get us?
46265,"Well I mean if you couldn't we'd get about Amtrak ticket orsomething, they're just really expensive"
46266,So is that a no?
46267,We'd also have to be alone in LA at night untik like 5 am
46268,How much is the gas?
46269,"Never mind we got it, thanks"
46270,"Alright, well I appreciate you trying to help and I'll see you Friday"
46271,"Alright. I'm on campus til 7, I could grab it from you if you want"
46272,Alright. Martinez right?
46273,Headed that way from campus now
46274,"I'm at work, can I call you in an hour? I can't text that"
46275,The bedbug peeps are coming friday <#>
46276,In work what's up?
